{
  "$schema": "http://json-schema.org/draft-07/schema#",
  "$id": "https://raw.githubusercontent.com/selfhosthub/studio-community/main/schemas/prompt.schema.json",
  "version": "1.0.0",
  "title": "Studio Prompt",
  "description": "A prompt template definition with text chunks and configurable variables.\n\nStability: future versions of this schema must remain backward-compatible with content authored against earlier versions of itself \u2014 once a package is published with a given version, it must continue to validate against the schema in force at install time. Add fields conservatively (optional first); promote to required only with a major schema revision and a migration story.",
  "type": "object",
  "required": [
    "id",
    "display_name",
    "version",
    "tier",
    "category",
    "description",
    "author",
    "chunks",
    "variables"
  ],
  "additionalProperties": false,
  "properties": {
    "$schema": {
      "type": "string"
    },
    "id": {
      "type": "string",
      "pattern": "^[a-z][a-z0-9-]*/[a-z][a-z0-9-]*$",
      "examples": [
        "shs-news-narrator",
        "shs-scene-description"
      ]
    },
    "display_name": {
      "type": "string",
      "minLength": 1
    },
    "version": {
      "type": "string",
      "pattern": "^\\d+\\.\\d+\\.\\d+$"
    },
    "tier": {
      "type": "string",
      "enum": [
        "community",
        "plus"
      ]
    },
    "category": {
      "type": "string",
      "description": "Prompt category for filtering.",
      "examples": [
        "story_generation",
        "scene_description",
        "summarization",
        "classification",
        "extraction",
        "rewriting",
        "copywriting",
        "research"
      ],
      "default": "general"
    },
    "description": {
      "type": "string",
      "maxLength": 300
    },
    "author": {
      "type": "string"
    },
    "chunks": {
      "type": "array",
      "description": "Ordered text chunks that are assembled into the final prompt.",
      "items": {
        "$ref": "#/$defs/promptChunk"
      },
      "default": []
    },
    "variables": {
      "type": "array",
      "description": "Configurable variables referenced by {{ name }} in chunk text.",
      "items": {
        "$ref": "#/$defs/promptVariable"
      },
      "default": []
    }
  },
  "$defs": {
    "promptChunk": {
      "type": "object",
      "required": [
        "text",
        "order",
        "role"
      ],
      "additionalProperties": false,
      "properties": {
        "text": {
          "type": "string",
          "description": "Prompt text. May contain {{ variable_name }} template expressions."
        },
        "variable": {
          "type": [
            "string",
            "null"
          ],
          "description": "Variable name this chunk is associated with. Null for static text chunks.",
          "default": null
        },
        "order": {
          "type": "integer",
          "description": "Assembly order. Lower = earlier in the prompt.",
          "minimum": 0,
          "default": 0
        },
        "role": {
          "type": "string",
          "description": "Chat message role for this chunk.",
          "enum": [
            "system",
            "user",
            "assistant"
          ],
          "default": "user"
        }
      }
    },
    "promptVariable": {
      "type": "object",
      "required": [
        "name",
        "label"
      ],
      "additionalProperties": false,
      "properties": {
        "name": {
          "type": "string",
          "description": "Variable identifier. Must match {{ name }} references in chunks."
        },
        "label": {
          "type": "string",
          "description": "Human-readable label shown in the form."
        },
        "type": {
          "type": "string",
          "description": "Variable type. 'enum' renders as a dropdown, 'string' as a text field, 'number' as a number input.",
          "enum": [
            "string",
            "enum",
            "number"
          ],
          "default": "string"
        },
        "options": {
          "type": [
            "array",
            "null"
          ],
          "description": "Available option values for enum-type variables. Null for other types.",
          "items": {
            "type": "string"
          },
          "default": null
        },
        "option_labels": {
          "type": [
            "array",
            "null"
          ],
          "description": "Parallel human-readable labels for each entry in `options`. Mirrors the provider-schema `enumNames` convention \u2014 must be the same length as `options` when present. The form schema endpoint uses these to render the dropdown while the raw `options` value is what gets stored. Null for non-enum types or when the raw values are already user-friendly.",
          "items": {
            "type": "string"
          },
          "default": null
        },
        "default": {
          "type": [
            "string",
            "null"
          ],
          "description": "Default value. Used during assembly if no value provided.",
          "default": null
        },
        "required": {
          "type": "boolean",
          "description": "When true, the form-schema endpoint surfaces this variable as a required form field AND Prompt.assemble() on the API raises if the value is empty. Use for load-bearing variables where the chunk must never drop. Defaults to false (optional \u2014 chunk drops silently when empty).",
          "default": false
        }
      }
    }
  }
}
