{
  "id": "shs/story-generator",
  "display_name": "Story Generator",
  "version": "1.0.0",
  "tier": "community",
  "category": "story_generation",
  "description": "Turns a news article or URL into a narrated voice-over script with structured hook, context, facts, and closing.",
  "author": "SelfHostHub",
  "chunks": [
    {
      "text": "You are a news narrator who writes compelling voice-over scripts from articles.\n\nReport exactly what the article says. Use the article's own language for names, titles, roles, organizations, and the stated purpose of events. Do not generalize, soften, or substitute your own framing.\n\nDo not invent names, quotes, statistics, or events not present in the article. If a detail is not explicitly stated, omit it.\n\nIf the source is a URL, use the publication date from the article's byline \u2014 not the URL. URL dates are unreliable and should be ignored.\n\nToday's date is {{ today_date }}.",
      "variable": null,
      "order": 0,
      "role": "system"
    },
    {
      "text": "Read the article below and write a ~200 word narration for a video voice-over.\n\nWrite in this exact order, separating each section with ---:\n\nHOOK: One sentence that makes the viewer stop scrolling. Lead with the most surprising or consequential element of the story.\n\nCONTEXT: Two to three sentences explaining why this story matters beyond the immediate event. What is at stake? Who is affected?\n\nFACTS: The core of the narration. Cover the who, what, when, where, and how using specific names, numbers, dates, and direct quotes from the article. Do not paraphrase quotes \u2014 use the exact words if quoting.\n\nCLOSE: One sentence directing the viewer to follow, share, or stay informed. Make it active, not passive.",
      "variable": null,
      "order": 1,
      "role": "user"
    },
    {
      "text": "Write the entire narration in {{ language | language_name }}.",
      "variable": "language",
      "order": 2,
      "role": "user"
    },
    {
      "text": "Use an informative, engaging tone. Report the story with the same specificity and framing the article uses, including any named movements, organizations, or stated positions.\n\nATTRIBUTION: If the article source is a URL, extract the domain and attribute it in the opening sentence (e.g. \"According to example-news.com...\"). If it is plain text with no URL, omit attribution.",
      "variable": null,
      "order": 3,
      "role": "user"
    },
    {
      "text": "Article:\n{{ article_text }}",
      "variable": "article_text",
      "order": 4,
      "role": "user"
    }
  ],
  "variables": [
    {
      "name": "article_text",
      "label": "Article (URL or text)",
      "type": "string",
      "options": null,
      "default": "",
      "required": true
    },
    {
      "name": "language",
      "label": "Language",
      "type": "enum",
      "options": [
        "en",
        "es",
        "fr",
        "de",
        "it",
        "pt",
        "nl",
        "pl",
        "ru",
        "zh",
        "ja",
        "ko",
        "ar",
        "hi",
        "tr",
        "sv",
        "da",
        "no",
        "fi"
      ],
      "option_labels": [
        "English",
        "Spanish",
        "French",
        "German",
        "Italian",
        "Portuguese",
        "Dutch",
        "Polish",
        "Russian",
        "Chinese",
        "Japanese",
        "Korean",
        "Arabic",
        "Hindi",
        "Turkish",
        "Swedish",
        "Danish",
        "Norwegian",
        "Finnish"
      ],
      "default": "en"
    }
  ]
}
